benchmarkGroup,name,reportLabel,peerReportLabel,descriptiveReportLabel,yearPrefix,yearOffset,dbColumn,inputType,description,options,computed,equation,excludeFromCompletion,includeInNationalReport,includeInBestPerformer,highIsBetter,yearsAvailable
"Form 3: Full-Time Faculty Benefits","FICA Covered Assistant Professor (9 Month)","FICA Covered Assistant Professor (9 Month)","FICA Covered Assistant Professor (9 Month)","FICA Covered Assistant Professor (9 Month)",AY,0,ft_fica_covered_assistant_professor_9_month,number,,,,,,1,,,2016
"Form 3: Full-Time Faculty Benefits","FICA Total Expenditure Instructor (9 Month)","FICA Total Expenditure Instructor (9 Month)","FICA Total Expenditure Instructor (9 Month)","FICA Total Expenditure Instructor (9 Month)",AY,0,ft_fica_expenditure_instructor_9_month,dollars,,,,,,1,,,2016
"Form 3: Full-Time Faculty Benefits","FICA Covered Instructor (9 Month)","FICA Covered Instructor (9 Month)","FICA Covered Instructor (9 Month)","FICA Covered Instructor (9 Month)",AY,0,ft_fica_covered_instructor_9_month,number,,,,,,1,,,2016
"Form 3: Full-Time Faculty Benefits","FICA Total Expenditure Lecturer (9 Month)","FICA Total Expenditure Lecturer (9 Month)","FICA Total Expenditure Lecturer (9 Month)","FICA Total Expenditure Lecturer (9 Month)",AY,0,ft_fica_expenditure_lecturer_9_month,dollars,,,,,,1,,,2016
"Form 3: Full-Time Faculty Benefits","FICA Covered Lecturer (9 Month)","FICA Covered Lecturer (9 Month)","FICA Covered Lecturer (9 Month)","FICA Covered Lecturer (9 Month)",AY,0,ft_fica_covered_lecturer_9_month,number,,,,,,1,,,2016
"Form 3: Full-Time Faculty Benefits","FICA Total Expenditure No Rank (9 Month)","FICA Total Expenditure No Rank (9 Month)","FICA Total Expenditure No Rank (9 Month)","FICA Total Expenditure No Rank (9 Month)",AY,0,ft_fica_expenditure_no_rank_9_month,dollars,,,,,,1,,,2016
"Form 3: Full-Time Faculty Benefits","FICA Covered No Rank (9 Month)","FICA Covered No Rank (9 Month)","FICA Covered No Rank (9 Month)","FICA Covered No Rank (9 Month)",AY,0,ft_fica_covered_no_rank_9_month,number,,,,,,1,,,2016
"Form 3: Full-Time Faculty Benefits","FICA Total Expenditure Undifferentiated Rank (9 Month)","FICA Total Expenditure Undifferentiated Rank (9 Month)","FICA Total Expenditure Undifferentiated Rank (9 Month)","FICA Total Expenditure Undifferentiated Rank (9 Month)",AY,0,ft_fica_expentirue_no_diff_9_month,dollars,,,,,,1,,,2016
"Form 3: Full-Time Faculty Benefits","FICA Covered Undifferentiated Rank (9 Month)","FICA Covered Undifferentiated Rank (9 Month)","FICA Covered Undifferentiated Rank (9 Month)","FICA Covered Undifferentiated Rank (9 Month)",AY,0,ft_fica_covered_no_diff_9_month,number,,,,,,1,,,2016
"Form 3: Full-Time Faculty Benefits","FICA Total Expenditure (9 Month)","FICA Total Expenditure (9 Month)","FICA Total Expenditure (9 Month)","FICA Total Expenditure (9 Month)",AY,0,ft_fica_total_expenditure_9_month,dollars,,,,,,1,,,2016
"Form 3: Full-Time Faculty Benefits","FICA Total Covered (9 Month)","FICA Total Covered (9 Month)","FICA Total Covered (9 Month)","FICA Total Covered (9 Month)",AY,0,ft_fica_total_covered_9_month,number,,,,,,1,,,2016
"Form 3: Full-Time Faculty Benefits","Unemployment Total Expenditure Professor (9 Month)","Unemployment Total Expenditure Professor (9 Month)","Unemployment Total Expenditure Professor (9 Month)","Unemployment Total Expenditure Professor (9 Month)",AY,0,ft_unemployment_expenditure_professor_9_month,dollars,,,,,,1,,,2016
"Form 3: Full-Time Faculty Benefits","Unemployment Covered Professor (9 Month)","Unemployment Covered Professor (9 Month)","Unemployment Covered Professor (9 Month)","Unemployment Covered Professor (9 Month)",AY,0,ft_unemployment_covered_professor_9_month,number,,,,,,1,,,2016
"Form 3: Full-Time Faculty Benefits","Unemployment Total Expenditure Associate Professor (9 Month)","Unemployment Total Expenditure Associate Professor (9 Month)","Unemployment Total Expenditure Associate Professor (9 Month)","Unemployment Total Expenditure Associate Professor (9 Month)",AY,0,ft_unemployment_expenditure_associate_professor_9_month,dollars,,,,,,1,,,2016
"Form 3: Full-Time Faculty Benefits","Unemployment Covered Associate Professor (9 Month)","Unemployment Covered Associate Professor (9 Month)","Unemployment Covered Associate Professor (9 Month)","Unemployment Covered Associate Professor (9 Month)",AY,0,ft_unemployment_covered_associate_professor_9_month,number,,,,,,1,,,2016
"Form 3: Full-Time Faculty Benefits","Unemployment Total Expenditure Assistant Professor (9 Month)","Unemployment Total Expenditure Assistant Professor (9 Month)","Unemployment Total Expenditure Assistant Professor (9 Month)","Unemployment Total Expenditure Assistant Professor (9 Month)",AY,0,ft_unemployment_expenditure_assistant_professor_9_month,dollars,,,,,,1,,,2016
"Form 3: Full-Time Faculty Benefits","Unemployment Covered Assistant Professor (9 Month)","Unemployment Covered Assistant Professor (9 Month)","Unemployment Covered Assistant Professor (9 Month)","Unemployment Covered Assistant Professor (9 Month)",AY,0,ft_unemployment_covered_assistant_professor_9_month,number,,,,,,1,,,2016
"Form 3: Full-Time Faculty Benefits","Unemployment Total Expenditure Instructor (9 Month)","Unemployment Total Expenditure Instructor (9 Month)","Unemployment Total Expenditure Instructor (9 Month)","Unemployment Total Expenditure Instructor (9 Month)",AY,0,ft_unemployment_expenditure_instructor_9_month,dollars,,,,,,1,,,2016
"Form 3: Full-Time Faculty Benefits","Unemployment Covered Instructor (9 Month)","Unemployment Covered Instructor (9 Month)","Unemployment Covered Instructor (9 Month)","Unemployment Covered Instructor (9 Month)",AY,0,ft_unemployment_covered_instructor_9_month,number,,,,,,1,,,2016
"Form 3: Full-Time Faculty Benefits","Unemployment Total Expenditure Lecturer (9 Month)","Unemployment Total Expenditure Lecturer (9 Month)","Unemployment Total Expenditure Lecturer (9 Month)","Unemployment Total Expenditure Lecturer (9 Month)",AY,0,ft_unemployment_expenditure_lecturer_9_month,dollars,,,,,,1,,,2016
"Form 3: Full-Time Faculty Benefits","Unemployment Covered Lecturer (9 Month)","Unemployment Covered Lecturer (9 Month)","Unemployment Covered Lecturer (9 Month)","Unemployment Covered Lecturer (9 Month)",AY,0,ft_unemployment_covered_lecturer_9_month,number,,,,,,1,,,2016
"Form 3: Full-Time Faculty Benefits","Unemployment Total Expenditure No Rank (9 Month)","Unemployment Total Expenditure No Rank (9 Month)","Unemployment Total Expenditure No Rank (9 Month)","Unemployment Total Expenditure No Rank (9 Month)",AY,0,ft_unemployment_expenditure_no_rank_9_month,dollars,,,,,,1,,,2016
"Form 3: Full-Time Faculty Benefits","Unemployment Covered No Rank (9 Month)","Unemployment Covered No Rank (9 Month)","Unemployment Covered No Rank (9 Month)","Unemployment Covered No Rank (9 Month)",AY,0,ft_unemployment_covered_no_rank_9_month,number,,,,,,1,,,2016
"Form 3: Full-Time Faculty Benefits","Unemployment Total Expenditure Undifferentiated Rank (9 Month)","Unemployment Total Expenditure Undifferentiated Rank (9 Month)","Unemployment Total Expenditure Undifferentiated Rank (9 Month)","Unemployment Total Expenditure Undifferentiated Rank (9 Month)",AY,0,ft_unemployment_expentirue_no_diff_9_month,dollars,,,,,,1,,,2016
"Form 3: Full-Time Faculty Benefits","Unemployment Covered Undifferentiated Rank (9 Month)","Unemployment Covered Undifferentiated Rank (9 Month)","Unemployment Covered Undifferentiated Rank (9 Month)","Unemployment Covered Undifferentiated Rank (9 Month)",AY,0,ft_unemployment_covered_no_diff_9_month,number,,,,,,1,,,2016
"Form 3: Full-Time Faculty Benefits","Unemployment Total Expenditure (9 Month)","Unemployment Total Expenditure (9 Month)","Unemployment Total Expenditure (9 Month)","Unemployment Total Expenditure (9 Month)",AY,0,ft_unemployment_total_expenditure_9_month,dollars,,,,,,1,,,2016
"Form 3: Full-Time Faculty Benefits","Unemployment Total Covered (9 Month)","Unemployment Total Covered (9 Month)","Unemployment Total Covered (9 Month)","Unemployment Total Covered (9 Month)",AY,0,ft_unemployment_total_covered_9_month,number,,,,,,1,,,2016
"Form 3: Full-Time Faculty Benefits","Group Life Total Expenditure Professor (9 Month)","Group Life Total Expenditure Professor (9 Month)","Group Life Total Expenditure Professor (9 Month)","Group Life Total Expenditure Professor (9 Month)",AY,0,ft_group_life_expenditure_professor_9_month,dollars,,,,,,1,,,2016
"Form 3: Full-Time Faculty Benefits","Group Life Covered Professor (9 Month)","Group Life Covered Professor (9 Month)","Group Life Covered Professor (9 Month)","Group Life Covered Professor (9 Month)",AY,0,ft_group_life_covered_professor_9_month,number,,,,,,1,,,2016
"Form 3: Full-Time Faculty Benefits","Group Life Total Expenditure Associate Professor (9 Month)","Group Life Total Expenditure Associate Professor (9 Month)","Group Life Total Expenditure Associate Professor (9 Month)","Group Life Total Expenditure Associate Professor (9 Month)",AY,0,ft_group_life_expenditure_associate_professor_9_month,dollars,,,,,,1,,,2016
"Form 3: Full-Time Faculty Benefits","Group Life Covered Associate Professor (9 Month)","Group Life Covered Associate Professor (9 Month)","Group Life Covered Associate Professor (9 Month)","Group Life Covered Associate Professor (9 Month)",AY,0,ft_group_life_covered_associate_professor_9_month,number,,,,,,1,,,2016
"Form 3: Full-Time Faculty Benefits","Group Life Total Expenditure Assistant Professor (9 Month)","Group Life Total Expenditure Assistant Professor (9 Month)","Group Life Total Expenditure Assistant Professor (9 Month)","Group Life Total Expenditure Assistant Professor (9 Month)",AY,0,ft_group_life_expenditure_assistant_professor_9_month,dollars,,,,,,1,,,2016
"Form 3: Full-Time Faculty Benefits","Group Life Covered Assistant Professor (9 Month)","Group Life Covered Assistant Professor (9 Month)","Group Life Covered Assistant Professor (9 Month)","Group Life Covered Assistant Professor (9 Month)",AY,0,ft_group_life_covered_assistant_professor_9_month,number,,,,,,1,,,2016
"Form 3: Full-Time Faculty Benefits","Group Life Total Expenditure Instructor (9 Month)","Group Life Total Expenditure Instructor (9 Month)","Group Life Total Expenditure Instructor (9 Month)","Group Life Total Expenditure Instructor (9 Month)",AY,0,ft_group_life_expenditure_instructor_9_month,dollars,,,,,,1,,,2016
"Form 3: Full-Time Faculty Benefits","Group Life Covered Instructor (9 Month)","Group Life Covered Instructor (9 Month)","Group Life Covered Instructor (9 Month)","Group Life Covered Instructor (9 Month)",AY,0,ft_group_life_covered_instructor_9_month,number,,,,,,1,,,2016
"Form 3: Full-Time Faculty Benefits","Group Life Total Expenditure Lecturer (9 Month)","Group Life Total Expenditure Lecturer (9 Month)","Group Life Total Expenditure Lecturer (9 Month)","Group Life Total Expenditure Lecturer (9 Month)",AY,0,ft_group_life_expenditure_lecturer_9_month,dollars,,,,,,1,,,2016
"Form 3: Full-Time Faculty Benefits","Group Life Covered Lecturer (9 Month)","Group Life Covered Lecturer (9 Month)","Group Life Covered Lecturer (9 Month)","Group Life Covered Lecturer (9 Month)",AY,0,ft_group_life_covered_lecturer_9_month,number,,,,,,1,,,2016
"Form 3: Full-Time Faculty Benefits","Group Life Total Expenditure No Rank (9 Month)","Group Life Total Expenditure No Rank (9 Month)","Group Life Total Expenditure No Rank (9 Month)","Group Life Total Expenditure No Rank (9 Month)",AY,0,ft_group_life_expenditure_no_rank_9_month,dollars,,,,,,1,,,2016
"Form 3: Full-Time Faculty Benefits","Group Life Covered No Rank (9 Month)","Group Life Covered No Rank (9 Month)","Group Life Covered No Rank (9 Month)","Group Life Covered No Rank (9 Month)",AY,0,ft_group_life_covered_no_rank_9_month,number,,,,,,1,,,2016
"Form 3: Full-Time Faculty Benefits","Group Life Total Expenditure Undifferentiated Rank (9 Month)","Group Life Total Expenditure Undifferentiated Rank (9 Month)","Group Life Total Expenditure Undifferentiated Rank (9 Month)","Group Life Total Expenditure Undifferentiated Rank (9 Month)",AY,0,ft_group_life_expentirue_no_diff_9_month,dollars,,,,,,1,,,2016
"Form 3: Full-Time Faculty Benefits","Group Life Covered Undifferentiated Rank (9 Month)","Group Life Covered Undifferentiated Rank (9 Month)","Group Life Covered Undifferentiated Rank (9 Month)","Group Life Covered Undifferentiated Rank (9 Month)",AY,0,ft_group_life_covered_no_diff_9_month,number,,,,,,1,,,2016
"Form 3: Full-Time Faculty Benefits","Group Life Total Expenditure (9 Month)","Group Life Total Expenditure (9 Month)","Group Life Total Expenditure (9 Month)","Group Life Total Expenditure (9 Month)",AY,0,ft_group_life_total_expenditure_9_month,dollars,,,,,,1,,,2016
"Form 3: Full-Time Faculty Benefits","Group Life Total Covered (9 Month)","Group Life Total Covered (9 Month)","Group Life Total Covered (9 Month)","Group Life Total Covered (9 Month)",AY,0,ft_group_life_total_covered_9_month,number,,,,,,1,,,2016
"Form 3: Full-Time Faculty Benefits","Worker Comp Total Expenditure Professor (9 Month)","Worker Comp Total Expenditure Professor (9 Month)","Worker Comp Total Expenditure Professor (9 Month)","Worker Comp Total Expenditure Professor (9 Month)",AY,0,ft_worker_comp_expenditure_professor_9_month,dollars,,,,,,1,,,2016
"Form 3: Full-Time Faculty Benefits","Worker Comp Covered Professor (9 Month)","Worker Comp Covered Professor (9 Month)","Worker Comp Covered Professor (9 Month)","Worker Comp Covered Professor (9 Month)",AY,0,ft_worker_comp_covered_professor_9_month,number,,,,,,1,,,2016
"Form 3: Full-Time Faculty Benefits","Worker Comp Total Expenditure Associate Professor (9 Month)","Worker Comp Total Expenditure Associate Professor (9 Month)","Worker Comp Total Expenditure Associate Professor (9 Month)","Worker Comp Total Expenditure Associate Professor (9 Month)",AY,0,ft_worker_comp_expenditure_associate_professor_9_month,dollars,,,,,,1,,,2016
"Form 3: Full-Time Faculty Benefits","Worker Comp Covered Associate Professor (9 Month)","Worker Comp Covered Associate Professor (9 Month)","Worker Comp Covered Associate Professor (9 Month)","Worker Comp Covered Associate Professor (9 Month)",AY,0,ft_worker_comp_covered_associate_professor_9_month,number,,,,,,1,,,2016
"Form 3: Full-Time Faculty Benefits","Worker Comp Total Expenditure Assistant Professor (9 Month)","Worker Comp Total Expenditure Assistant Professor (9 Month)","Worker Comp Total Expenditure Assistant Professor (9 Month)","Worker Comp Total Expenditure Assistant Professor (9 Month)",AY,0,ft_worker_comp_expenditure_assistant_professor_9_month,dollars,,,,,,1,,,2016
"Form 3: Full-Time Faculty Benefits","Worker Comp Covered Assistant Professor (9 Month)","Worker Comp Covered Assistant Professor (9 Month)","Worker Comp Covered Assistant Professor (9 Month)","Worker Comp Covered Assistant Professor (9 Month)",AY,0,ft_worker_comp_covered_assistant_professor_9_month,number,,,,,,1,,,2016
"Form 3: Full-Time Faculty Benefits","Worker Comp Total Expenditure Instructor (9 Month)","Worker Comp Total Expenditure Instructor (9 Month)","Worker Comp Total Expenditure Instructor (9 Month)","Worker Comp Total Expenditure Instructor (9 Month)",AY,0,ft_worker_comp_expenditure_instructor_9_month,dollars,,,,,,1,,,2016
"Form 3: Full-Time Faculty Benefits","Worker Comp Covered Instructor (9 Month)","Worker Comp Covered Instructor (9 Month)","Worker Comp Covered Instructor (9 Month)","Worker Comp Covered Instructor (9 Month)",AY,0,ft_worker_comp_covered_instructor_9_month,number,,,,,,1,,,2016
"Form 3: Full-Time Faculty Benefits","Worker Comp Total Expenditure Lecturer (9 Month)","Worker Comp Total Expenditure Lecturer (9 Month)","Worker Comp Total Expenditure Lecturer (9 Month)","Worker Comp Total Expenditure Lecturer (9 Month)",AY,0,ft_worker_comp_expenditure_lecturer_9_month,dollars,,,,,,1,,,2016
"Form 3: Full-Time Faculty Benefits","Worker Comp Covered Lecturer (9 Month)","Worker Comp Covered Lecturer (9 Month)","Worker Comp Covered Lecturer (9 Month)","Worker Comp Covered Lecturer (9 Month)",AY,0,ft_worker_comp_covered_lecturer_9_month,number,,,,,,1,,,2016
"Form 3: Full-Time Faculty Benefits","Worker Comp Total Expenditure No Rank (9 Month)","Worker Comp Total Expenditure No Rank (9 Month)","Worker Comp Total Expenditure No Rank (9 Month)","Worker Comp Total Expenditure No Rank (9 Month)",AY,0,ft_worker_comp_expenditure_no_rank_9_month,dollars,,,,,,1,,,2016
"Form 3: Full-Time Faculty Benefits","Worker Comp Covered No Rank (9 Month)","Worker Comp Covered No Rank (9 Month)","Worker Comp Covered No Rank (9 Month)","Worker Comp Covered No Rank (9 Month)",AY,0,ft_worker_comp_covered_no_rank_9_month,number,,,,,,1,,,2016
"Form 3: Full-Time Faculty Benefits","Worker Comp Total Expenditure Undifferentiated Rank (9 Month)","Worker Comp Total Expenditure Undifferentiated Rank (9 Month)","Worker Comp Total Expenditure Undifferentiated Rank (9 Month)","Worker Comp Total Expenditure Undifferentiated Rank (9 Month)",AY,0,ft_worker_comp_expentirue_no_diff_9_month,dollars,,,,,,1,,,2016
"Form 3: Full-Time Faculty Benefits","Worker Comp Covered Undifferentiated Rank (9 Month)","Worker Comp Covered Undifferentiated Rank (9 Month)","Worker Comp Covered Undifferentiated Rank (9 Month)","Worker Comp Covered Undifferentiated Rank (9 Month)",AY,0,ft_worker_comp_covered_no_diff_9_month,number,,,,,,1,,,2016
"Form 3: Full-Time Faculty Benefits","Worker Comp Total Expenditure (9 Month)","Worker Comp Total Expenditure (9 Month)","Worker Comp Total Expenditure (9 Month)","Worker Comp Total Expenditure (9 Month)",AY,0,ft_worker_comp_total_expenditure_9_month,dollars,,,,,,1,,,2016
"Form 3: Full-Time Faculty Benefits","Worker Comp Total Covered (9 Month)","Worker Comp Total Covered (9 Month)","Worker Comp Total Covered (9 Month)","Worker Comp Total Covered (9 Month)",AY,0,ft_worker_comp_total_covered_9_month,number,,,,,,1,,,2016
"Form 3: Full-Time Faculty Benefits","Other Total Expenditure Professor (9 Month)","Other Total Expenditure Professor (9 Month)","Other Total Expenditure Professor (9 Month)","Other Total Expenditure Professor (9 Month)",AY,0,ft_other_expenditure_professor_9_month,dollars,,,,,,1,,,2016
"Form 3: Full-Time Faculty Benefits","Other Covered Professor (9 Month)","Other Covered Professor (9 Month)","Other Covered Professor (9 Month)","Other Covered Professor (9 Month)",AY,0,ft_other_covered_professor_9_month,number,,,,,,1,,,2016
"Form 3: Full-Time Faculty Benefits","Other Total Expenditure Associate Professor (9 Month)","Other Total Expenditure Associate Professor (9 Month)","Other Total Expenditure Associate Professor (9 Month)","Other Total Expenditure Associate Professor (9 Month)",AY,0,ft_other_expenditure_associate_professor_9_month,dollars,,,,,,1,,,2016
"Form 3: Full-Time Faculty Benefits","Other Covered Associate Professor (9 Month)","Other Covered Associate Professor (9 Month)","Other Covered Associate Professor (9 Month)","Other Covered Associate Professor (9 Month)",AY,0,ft_other_covered_associate_professor_9_month,number,,,,,,1,,,2016
"Form 3: Full-Time Faculty Benefits","Other Total Expenditure Assistant Professor (9 Month)","Other Total Expenditure Assistant Professor (9 Month)","Other Total Expenditure Assistant Professor (9 Month)","Other Total Expenditure Assistant Professor (9 Month)",AY,0,ft_other_expenditure_assistant_professor_9_month,dollars,,,,,,1,,,2016
"Form 3: Full-Time Faculty Benefits","Other Covered Assistant Professor (9 Month)","Other Covered Assistant Professor (9 Month)","Other Covered Assistant Professor (9 Month)","Other Covered Assistant Professor (9 Month)",AY,0,ft_other_covered_assistant_professor_9_month,number,,,,,,1,,,2016
"Form 3: Full-Time Faculty Benefits","Other Total Expenditure Instructor (9 Month)","Other Total Expenditure Instructor (9 Month)","Other Total Expenditure Instructor (9 Month)","Other Total Expenditure Instructor (9 Month)",AY,0,ft_other_expenditure_instructor_9_month,dollars,,,,,,1,,,2016
"Form 3: Full-Time Faculty Benefits","Other Covered Instructor (9 Month)","Other Covered Instructor (9 Month)","Other Covered Instructor (9 Month)","Other Covered Instructor (9 Month)",AY,0,ft_other_covered_instructor_9_month,number,,,,,,1,,,2016
"Form 3: Full-Time Faculty Benefits","Other Total Expenditure Lecturer (9 Month)","Other Total Expenditure Lecturer (9 Month)","Other Total Expenditure Lecturer (9 Month)","Other Total Expenditure Lecturer (9 Month)",AY,0,ft_other_expenditure_lecturer_9_month,dollars,,,,,,1,,,2016
"Form 3: Full-Time Faculty Benefits","Other Covered Lecturer (9 Month)","Other Covered Lecturer (9 Month)","Other Covered Lecturer (9 Month)","Other Covered Lecturer (9 Month)",AY,0,ft_other_covered_lecturer_9_month,number,,,,,,1,,,2016
"Form 3: Full-Time Faculty Benefits","Other Total Expenditure No Rank (9 Month)","Other Total Expenditure No Rank (9 Month)","Other Total Expenditure No Rank (9 Month)","Other Total Expenditure No Rank (9 Month)",AY,0,ft_other_expenditure_no_rank_9_month,dollars,,,,,,1,,,2016
"Form 3: Full-Time Faculty Benefits","Other Covered No Rank (9 Month)","Other Covered No Rank (9 Month)","Other Covered No Rank (9 Month)","Other Covered No Rank (9 Month)",AY,0,ft_other_covered_no_rank_9_month,number,,,,,,1,,,2016
"Form 3: Full-Time Faculty Benefits","Other Total Expenditure Undifferentiated Rank (9 Month)","Other Total Expenditure Undifferentiated Rank (9 Month)","Other Total Expenditure Undifferentiated Rank (9 Month)","Other Total Expenditure Undifferentiated Rank (9 Month)",AY,0,ft_other_expentirue_no_diff_9_month,dollars,,,,,,1,,,2016
"Form 3: Full-Time Faculty Benefits","Other Covered Undifferentiated Rank (9 Month)","Other Covered Undifferentiated Rank (9 Month)","Other Covered Undifferentiated Rank (9 Month)","Other Covered Undifferentiated Rank (9 Month)",AY,0,ft_other_covered_no_diff_9_month,number,,,,,,1,,,2016
"Form 3: Full-Time Faculty Benefits","Other Total Expenditure (9 Month)","Other Total Expenditure (9 Month)","Other Total Expenditure (9 Month)","Other Total Expenditure (9 Month)",AY,0,ft_other_total_expenditure_9_month,dollars,,,,,,1,,,2016
"Form 3: Full-Time Faculty Benefits","Other Total Covered (9 Month)","Other Total Covered (9 Month)","Other Total Covered (9 Month)","Other Total Covered (9 Month)",AY,0,ft_other_total_covered_9_month,number,,,,,,1,,,2016
"Form 3: Full-Time Faculty Benefits","Total Benefits Total Expenditure Professor (9 Month)","Total Benefits Total Expenditure Professor (9 Month)","Total Benefits Total Expenditure Professor (9 Month)","Total Benefits Total Expenditure Professor (9 Month)",AY,0,ft_total_benefits_expenditure_professor_9_month,dollars,,,1,"{{ft_retirement_expenditure_professor_9_month}} + 
{{ft_medical_expenditure_professor_9_month}} + {{ft_dental_expenditure_professor_9_month}} + 
{{ft_combined_medical_dental_expenditure_professor_9_month}} + 
{{ft_disability_expenditure_professor_9_month}} + {{ft_tuition_expenditure_professor_9_month}} + 
{{ft_fica_expenditure_professor_9_month}} + {{ft_unemployment_expenditure_professor_9_month}} + 
{{ft_group_life_expenditure_professor_9_month}} + {{ft_worker_comp_expenditure_professor_9_month}} + 
{{ft_other_expenditure_professor_9_month}}",,1,,,2016
"Form 3: Full-Time Faculty Benefits","Total Benefits Covered Professor (9 Month)","Total Benefits Covered Professor (9 Month)","Total Benefits Covered Professor (9 Month)","Total Benefits Covered Professor (9 Month)",AY,0,ft_total_benefits_covered_professor_9_month,number,,,1,,,1,,,2016
"Form 3: Full-Time Faculty Benefits","Total Benefits Total Expenditure Associate Professor (9 Month)","Total Benefits Total Expenditure Associate Professor (9 Month)","Total Benefits Total Expenditure Associate Professor (9 Month)","Total Benefits Total Expenditure Associate Professor (9 Month)",AY,0,ft_total_benefits_expenditure_associate_professor_9_month,dollars,,,1,"{{ft_retirement_expenditure_associate_professor_9_month}} + 
{{ft_medical_expenditure_associate_professor_9_month}} + 
{{ft_dental_expenditure_associate_professor_9_month}} + 
{{ft_combined_medical_dental_expenditure_associate_prof_9_month}} + 
{{ft_disability_expenditure_associate_professor_9_month}} + 
{{ft_tuition_expenditure_associate_professor_9_month}} + 
{{ft_fica_expenditure_associate_professor_9_month}} + 
{{ft_unemployment_expenditure_associate_professor_9_month}} + 
{{ft_group_life_expenditure_associate_professor_9_month}} + 
{{ft_worker_comp_expenditure_associate_professor_9_month}} + 
{{ft_other_expenditure_associate_professor_9_month}}",,1,,,2016
"Form 3: Full-Time Faculty Benefits","Total Benefits Covered Associate Professor (9 Month)","Total Benefits Covered Associate Professor (9 Month)","Total Benefits Covered Associate Professor (9 Month)","Total Benefits Covered Associate Professor (9 Month)",AY,0,ft_total_benefits_covered_associate_professor_9_month,computed,,,1,,,1,,,2016
"Form 3: Full-Time Faculty Benefits","Total Benefits Total Expenditure Assistant Professor (9 Month)","Total Benefits Total Expenditure Assistant Professor (9 Month)","Total Benefits Total Expenditure Assistant Professor (9 Month)","Total Benefits Total Expenditure Assistant Professor (9 Month)",AY,0,ft_total_benefits_expenditure_assistant_professor_9_month,dollars,,,1,"{{ft_retirement_expenditure_assistant_professor_9_month}} + 
{{ft_medical_expenditure_assistant_professor_9_month}} + 
{{ft_dental_expenditure_assistant_professor_9_month}} + 
{{ft_combined_medical_dental_expenditure_assistant_prof_9_month}} + 
{{ft_disability_expenditure_assistant_professor_9_month}} + 
{{ft_tuition_expenditure_assistant_professor_9_month}} + 
{{ft_fica_expenditure_assistant_professor_9_month}} + 
{{ft_unemployment_expenditure_assistant_professor_9_month}} + 
{{ft_group_life_expenditure_assistant_professor_9_month}} + 
{{ft_worker_comp_expenditure_assistant_professor_9_month}} + 
{{ft_other_expenditure_assistant_professor_9_month}}",,1,,,2016
