benchmarkGroup,name,reportLabel,peerReportLabel,descriptiveReportLabel,yearPrefix,yearOffset,dbColumn,inputType,description,options,computed,equation,excludeFromCompletion,includeInNationalReport,includeInBestPerformer,highIsBetter,yearsAvailable
"Form 1: Institutional Information",Control,"Insitutional Control","Institutional Control","Institutional Control",AY,0,institution_control,radio,"Use Institutional Control from 2014 - 2015 IPEDS General Information","Public
Private For-Profit
Private Not-For-Profit (No Religious Affiliation)
Private Not-For-Profit (Religious Affiliation)
Not Reported",,,,,1,,2016
"Form 1: Institutional Information","Sector of Institution","Sector of Institution","Sector of Institution","Sector of Institution",AY,0,institution_sector,radio,"Use Institutional Sector from 2014 - 2015 IPEDS General Information","Public, 4-year or above
Private not-for-profit, 4-year or above
Private for-profit, 4-year or above
Public, 2-year
Private not-for-profit, 2-year
Private for-profit, 2-year",,,,,,,2016
"Form 1: Institutional Information","AAUP Category","AAUP Institutional Category","AAUP Institutional Category","AAUP Institutional Category",AY,0,institution_aaup_category,radio,"Use Faculty Compensation Survey Institutional Category","Doctoral
Master's
Baccalaureate
Associate's with Ranks
Associate's without Ranks",,,,,,,2016
"Form 1: Institutional Information","Carnegie Classification","Carnegie Classification: Basic","Carnegie Classification: Basic","Carnegie Classification: Basic",AY,0,carnegie_basic,radio,"Use Carnegie Classification: Basic from 2014 - 2015 IPEDS General Information","Associate's--Public Rural-serving Small
Associate's--Public Rural-serving Medium
Associate's--Public Rural-serving Large
Associate's--Public Suburban-serving Single Campus
Associate's--Public Suburban-serving Multicampus
Associate's--Public Urban-serving Single Campus
Associate's--Public Urban-serving Multicampus
Associate's--Public Special Use
Associate's--Private Not-for-profit
Associate's--Private For-profit
Associate's--Public 2-year colleges under 4-year universities
Associate's--Public 4-year Primarily Associate's
Associate's--Private Not-for-profit 4-year Primarily Associate's
Associate's--Private For-profit 4-year Primarily Associate's
Research Universities (very high research activity)
Research Universities (high research activity)
Doctoral/Research Universities
Master's Colleges and Universities (larger programs)
Master's Colleges and Universities (medium programs)
Master's Colleges and Universities (smaller programs)
Baccalaureate Colleges--Arts & Sciences
Baccalaureate Colleges--Diverse Fields
Baccalaureate/Associate's Colleges
Theological seminaries, Bible colleges, and other faith-related institutions
Medical schools and medical centers
Other health professions schools
Schools of engineering
Other technology-related schools
Schools of business and management
Schools of art, music, and design
Schools of law
Other special-focus institutions
Tribal Colleges
Not applicable, not in Carnegie universe (not accredited or nondegree-granting)",,,,,,,2016
"Form 1: Institutional Information",System,"System of Higher Education","System of Higher Education","System of Higher Education",AY,0,institution_system,text,"Use Faculty Compensation Survey System List",,,,,,,,2016
"Form 1: Institutional Information","Highest Degree Offered","Highest Degree Offered","Highest Degree Offered","Highest Degree Offered",AY,0,institution_highest_degree,text,"Use Highest Degree Offered from 2014 - 2015 IPEDS General Information",,,,,,,,2016
"Form 1: Institutional Information","Institution Grants Medical Degree","Institution Grants Medical Degree","Institution Grants Medical Degree","Institution Grants Medical Degree",AY,0,institution_grants_medical_degree,radio,"Use Institution Grants Medical Degree from 2014 - 2015 IPEDS General Information","Yes
No",,,,,,,2016
"Form 1: Institutional Information","Publication Footnote","Publication Footnote","Publication Footnote","Publication Footnote",AY,0,institution_publication_footnote,text,"Use Faculty Compensation Survey Publication Footnote",,,,1,,,,2016
"Form 1: Institutional Information","Conversion Factor","Conversion Factor","Conversion Factor","Conversion Factor",AY,0,institution_conversion_factor,float,"Use Faculty Compensation Survey Converion Factor",,,,1,,,,2016
"Form 1: Institutional Information","Eligible CIP Codes","Number of Eligible CIP Codes","Number of Eligible CIP Codes","Number of Eligible CIP Codes",AY,0,institution_eligible_cip_codes,number,,,,,1,,,,2016
"Form 1: Institutional Information",Campuses,"Campuses Reported Under Institution","Campuses Reported Under Institution","Campuses Reported Under Institution",AY,0,institution_campuses,radio,,"Institution is part of a multi-institution or multi-campus organization
Institution is NOT part of a multi-institution or multi-campus organization",,,,,,,2016
"Form 1: Institutional Information",Comments,"Comments to Institution","Comments to Institution","Comments to Institution",AY,0,institution_comments,textarea,,,,,1,,,,2016
"Form 1: Institutional Information","Add Comment","Comments to AAUP","Comments to AAUP","Comments to AAUP",AY,0,institution_add_comment,textarea,,,,,1,,,,2016
"Form 1: Institutional Information","Accuracy Confirmation","Institutional Information is Accurate","Institutional Information is Accurate","Institutional Information is Accurate",AY,0,institution_accurarcy_confirmation,text,,,,,1,,,,"2016,2017,2018,2019"
"Form 1: Institutional Information","Deadline Change","Request Deadline Change","Request Deadline Change","Request Deadline Change",AY,0,institution_deadline_change,text,,,,,1,,,,2016
"Form 1: Institutional Information",Non-Submission,"Institution Declines to Submit Data","Institution Declines to Submit Data",Institution,AY,0,institution_non_submission,radio,,Decline,,,1,,,,2016
"Form 1: Institutional Information","Tenure System","Institution Has Tenure System","Institution Has Tenure System","Institution Has Tenure System",AY,0,institution_tenure_system,radio,,"No Tenure System
Tenure System
Do Not Know",,,,,,,2016
"Form 1: Institutional Information","Faculty Union","Institution Has Faculty Union","Institution Has Faculty Union","Institution Has Faculty Union",AY,0,institution_faculty_union,radio,,"No Faculty Union
Some Faculty System
All Faculty Part of Union System
Do Not Know",,,,,,,2016
"Form 1: Institutional Information","Part-Time Benefits","Institution Has Part-Time Benefits","Institution Has Part-Time Benefits","Institution Has Part-Time Benefits",AY,0,institution_part_time_benefits,radio,,"No Part-Time Benefits
Some Faculty Part-Time Benefits
All Part-Time Faculty Have Benefits
Do Not Know",,,,,,,2016
"Form 2: Full-Time Faculty Salary","Number of Male Professors (9 Month)","Number of Male Professors (9 Month)","Number of Male Professors (9 Month)","Number of Male Professors (9 Month)",AY,0,ft_male_professor_number_9_month,number,,,,,,1,1,,2016
"Form 2: Full-Time Faculty Salary","Total Contracted Salaries Male Professors (9 Month)","Total Contracted Salaries Male Professors (9 Month)","Total Contracted Salaries Male Professors (9 Month)","Total Contracted Salaries Male Professors (9 Month)",AY,0,ft_male_professor_salaries_9_month,dollars,,,,,,1,1,,2016
"Form 2: Full-Time Faculty Salary","Number of Male Professors Non-Tenure Track (9 Month)","Number of Male Professors Non-Tenure Track (9 Month)","Number of Male Professors Non-Tenure Track (9 Month)","Number of Male Professors Non-Tenure Track (9 Month)",AY,0,ft_male_professor_ntt_9_month,number,,,,,,1,1,,2016
"Form 2: Full-Time Faculty Salary","Number of Male Professors Tenure Track (9 Month)","Number of Male Professors Tenure Track (9 Month)","Number of Male Professors Tenure Track (9 Month)","Number of Male Professors Tenure Track (9 Month)",AY,0,ft_male_professor_tt_9_month,number,,,,,,1,1,,2016
"Form 2: Full-Time Faculty Salary","Number of Male Professors Tenured (9 Month)","Number of Male Professors Tenured (9 Month)","Number of Male Professors Tenured (9 Month)","Number of Male Professors Tenured (9 Month)",AY,0,ft_male_professor_t_9_month,number,,,,,,1,1,,2016
"Form 2: Full-Time Faculty Salary","Number of Female Professors (9 Month)","Number of Female Professors (9 Month)","Number of Female Professors (9 Month)","Number of Female Professors (9 Month)",AY,0,ft_female_professor_number_9_month,number,,,,,,1,1,,2016
"Form 2: Full-Time Faculty Salary","Total Contracted Salaries Female Professors (9 Month)","Total Contracted Salaries Female Professors (9 Month)","Total Contracted Salaries Female Professors (9 Month)","Total Contracted Salaries Female Professors (9 Month)",AY,0,ft_female_professor_salaries_9_month,dollars,,,,,,1,1,,2016
"Form 2: Full-Time Faculty Salary","Number of Female Professors Non-Tenure Track (9 Month)","Number of Female Professors Non-Tenure Track (9 Month)","Number of Female Professors Non-Tenure Track (9 Month)","Number of Female Professors Non-Tenure Track (9 Month)",AY,0,ft_female_professor_ntt_9_month,number,,,,,,1,1,,2016
"Form 2: Full-Time Faculty Salary","Number of Female Professors Tenure Track (9 Month)","Number of Female Professors Tenure Track (9 Month)","Number of Female Professors Tenure Track (9 Month)","Number of Female Professors Tenure Track (9 Month)",AY,0,ft_female_professor_tt_9_month,number,,,,,,1,1,,2016
"Form 2: Full-Time Faculty Salary","Number of Female Professors Tenured (9 Month)","Number of Female Professors Tenured (9 Month)","Number of Female Professors Tenured (9 Month)","Number of Female Professors Tenured (9 Month)",AY,0,ft_female_professor_t_9_month,number,,,,,,1,1,,2016
"Form 2: Full-Time Faculty Salary","Number of Male Associate Professors (9 Month)","Number of Male Associate Professors (9 Month)","Number of Male Associate Professors (9 Month)","Number of Male Associate Professors (9 Month)",AY,0,ft_male_associate_professor_number_9_month,number,,,,,,1,1,,2016
"Form 2: Full-Time Faculty Salary","Total Contracted Salaries Male Associate Professors (9 Month)","Total Contracted Salaries Male Associate Professors (9 Month)","Total Contracted Salaries Male Associate Professors (9 Month)","Total Contracted Salaries Male Associate Professors (9 Month)",AY,0,ft_male_associate_professor_salaries_9_month,dollars,,,,,,1,1,,2016
"Form 2: Full-Time Faculty Salary","Number of Male Associate Professors Non-Tenure Track (9 Month)","Number of Male Associate Professors Non-Tenure Track (9 Month)","Number of Male Associate Professors Non-Tenure Track (9 Month)","Number of Male Associate Professors Non-Tenure Track (9 Month)",AY,0,ft_male_associate_professor_ntt_9_month,number,,,,,,1,1,,2016
"Form 2: Full-Time Faculty Salary","Number of Male Associate Professors Tenure Track (9 Month)","Number of Male Associate Professors Tenure Track (9 Month)","Number of Male Associate Professors Tenure Track (9 Month)","Number of Male Associate Professors Tenure Track (9 Month)",AY,0,ft_male_associate_professor_tt_9_month,number,,,,,,1,1,,2016
"Form 2: Full-Time Faculty Salary","Number of Male Associate Professors Tenured (9 Month)","Number of Male Associate Professors Tenured (9 Month)","Number of Male Associate Professors Tenured (9 Month)","Number of Male Associate Professors Tenured (9 Month)",AY,0,ft_male_associate_professor_t_9_month,number,,,,,,1,1,,2016
"Form 2: Full-Time Faculty Salary","Number of Female Associate Professors (9 Month)","Number of Female Associate Professors (9 Month)","Number of Female Associate Professors (9 Month)","Number of Female Associate Professors (9 Month)",AY,0,ft_female_associate_professor_number_9_month,number,,,,,,1,1,,2016
"Form 2: Full-Time Faculty Salary","Total Contracted Salaries Female Associate Professors (9 Month)","Total Contracted Salaries Female Associate Professors (9 Month)","Total Contracted Salaries Female Associate Professors (9 Month)","Total Contracted Salaries Female Associate Professors (9 Month)",AY,0,ft_female_associate_professor_salaries_9_month,dollars,,,,,,1,1,,2016
"Form 2: Full-Time Faculty Salary","Number of Female Associate Professors Non-Tenure Track (9 Month)","Number of Female Associate Professors Non-Tenure Track (9 Month)","Number of Female Associate Professors Non-Tenure Track (9 Month)","Number of Female Associate Professors Non-Tenure Track (9 Month)",AY,0,ft_female_associate_professor_ntt_9_month,number,,,,,,1,1,,2016
"Form 2: Full-Time Faculty Salary","Number of Female Associate Professors Tenure Track (9 Month)","Number of Female Associate Professors Tenure Track (9 Month)","Number of Female Associate Professors Tenure Track (9 Month)","Number of Female Associate Professors Tenure Track (9 Month)",AY,0,ft_female_associate_professor_tt_9_month,number,,,,,,1,1,,2016
"Form 2: Full-Time Faculty Salary","Number of Female Associate Professors Tenured (9 Month)","Number of Female Associate Professors Tenured (9 Month)","Number of Female Associate Professors Tenured (9 Month)","Number of Female Associate Professors Tenured (9 Month)",AY,0,ft_female_associate_professor_t_9_month,number,,,,,,1,1,,2016
"Form 2: Full-Time Faculty Salary","Number of Male Assistant Professors (9 Month)","Number of Male Assistant Professors (9 Month)","Number of Male Assistant Professors (9 Month)","Number of Male Assistant Professors (9 Month)",AY,0,ft_male_assistant_professor_number_9_month,number,,,,,,1,1,,2016
"Form 2: Full-Time Faculty Salary","Total Contracted Salaries Male Assistant Professors (9 Month)","Total Contracted Salaries Male Assistant Professors (9 Month)","Total Contracted Salaries Male Assistant Professors (9 Month)","Total Contracted Salaries Male Assistant Professors (9 Month)",AY,0,ft_male_assistant_professor_salaries_9_month,dollars,,,,,,1,1,,2016
"Form 2: Full-Time Faculty Salary","Number of Male Assistant Professors Non-Tenure Track (9 Month)","Number of Male Assistant Professors Non-Tenure Track (9 Month)","Number of Male Assistant Professors Non-Tenure Track (9 Month)","Number of Male Assistant Professors Non-Tenure Track (9 Month)",AY,0,ft_male_assistant_professor_ntt_9_month,number,,,,,,1,1,,2016
"Form 2: Full-Time Faculty Salary","Number of Male Assistant Professors Tenure Track (9 Month)","Number of Male Assistant Professors Tenure Track (9 Month)","Number of Male Assistant Professors Tenure Track (9 Month)","Number of Male Assistant Professors Tenure Track (9 Month)",AY,0,ft_male_assistant_professor_tt_9_month,number,,,,,,1,1,,2016
"Form 2: Full-Time Faculty Salary","Number of Male Assistant Professors Tenured (9 Month)","Number of Male Assistant Professors Tenured (9 Month)","Number of Male Assistant Professors Tenured (9 Month)","Number of Male Assistant Professors Tenured (9 Month)",AY,0,ft_male_assistant_professor_t_9_month,number,,,,,,1,1,,2016
"Form 2: Full-Time Faculty Salary","Number of Female Assistant Professors (9 Month)","Number of Female Assistant Professors (9 Month)","Number of Female Assistant Professors (9 Month)","Number of Female Assistant Professors (9 Month)",AY,0,ft_female_assistant_professor_number_9_month,number,,,,,,1,1,,2016
"Form 2: Full-Time Faculty Salary","Total Contracted Salaries Female Assistant Professors (9 Month)","Total Contracted Salaries Female Assistant Professors (9 Month)","Total Contracted Salaries Female Assistant Professors (9 Month)","Total Contracted Salaries Female Assistant Professors (9 Month)",AY,0,ft_female_assistant_professor_salaries_9_month,dollars,,,,,,1,1,,2016
"Form 2: Full-Time Faculty Salary","Number of Female Assistant Professors Non-Tenure Track (9 Month)","Number of Female Assistant Professors Non-Tenure Track (9 Month)","Number of Female Assistant Professors Non-Tenure Track (9 Month)","Number of Female Assistant Professors Non-Tenure Track (9 Month)",AY,0,ft_female_assistant_professor_ntt_9_month,number,,,,,,1,1,,2016
"Form 2: Full-Time Faculty Salary","Number of Female Assistant Professors Tenure Track (9 Month)","Number of Female Assistant Professors Tenure Track (9 Month)","Number of Female Assistant Professors Tenure Track (9 Month)","Number of Female Assistant Professors Tenure Track (9 Month)",AY,0,ft_female_assistant_professor_tt_9_month,number,,,,,,1,1,,2016
"Form 2: Full-Time Faculty Salary","Number of Female Assistant Professors Tenured (9 Month)","Number of Female Assistant Professors Tenured (9 Month)","Number of Female Assistant Professors Tenured (9 Month)","Number of Female Assistant Professors Tenured (9 Month)",AY,0,ft_female_assistant_professor_t_9_month,number,,,,,,1,1,,2016
"Form 2: Full-Time Faculty Salary","Number of Male Instructors (9 Month)","Number of Male Instructors (9 Month)","Number of Male Instructors (9 Month)","Number of Male Instructors (9 Month)",AY,0,ft_male_instructor_number_9_month,number,,,,,,1,1,,2016
"Form 2: Full-Time Faculty Salary","Total Contracted Salaries Male Instructors (9 Month)","Total Contracted Salaries Male Instructors (9 Month)","Total Contracted Salaries Male Instructors (9 Month)","Total Contracted Salaries Male Instructors (9 Month)",AY,0,ft_male_instructor_salaries_9_month,dollars,,,,,,1,1,,2016
"Form 2: Full-Time Faculty Salary","Number of Male Instructors Non-Tenure Track (9 Month)","Number of Male Instructors Non-Tenure Track (9 Month)","Number of Male Instructors Non-Tenure Track (9 Month)","Number of Male Instructors Non-Tenure Track (9 Month)",AY,0,ft_male_instructor_ntt_9_month,number,,,,,,1,1,,2016
"Form 2: Full-Time Faculty Salary","Number of Male Instructors Tenure Track (9 Month)","Number of Male Instructors Tenure Track (9 Month)","Number of Male Instructors Tenure Track (9 Month)","Number of Male Instructors Tenure Track (9 Month)",AY,0,ft_male_instructor_tt_9_month,number,,,,,,1,1,,2016
"Form 2: Full-Time Faculty Salary","Number of Male Instructors Tenured (9 Month)","Number of Male Instructors Tenured (9 Month)","Number of Male Instructors Tenured (9 Month)","Number of Male Instructors Tenured (9 Month)",AY,0,ft_male_instructor_t_9_month,number,,,,,,1,1,,2016
"Form 2: Full-Time Faculty Salary","Number of Female Instructors (9 Month)","Number of Female Instructors (9 Month)","Number of Female Instructors (9 Month)","Number of Female Instructors (9 Month)",AY,0,ft_female_instructor_number_9_month,number,,,,,,1,1,,2016
"Form 2: Full-Time Faculty Salary","Total Contracted Salaries Female Instructors (9 Month)","Total Contracted Salaries Female Instructors (9 Month)","Total Contracted Salaries Female Instructors (9 Month)","Total Contracted Salaries Female Instructors (9 Month)",AY,0,ft_female_instructor_salaries_9_month,dollars,,,,,,1,1,,2016
"Form 2: Full-Time Faculty Salary","Number of Female Instructors Non-Tenure Track (9 Month)","Number of Female Instructors Non-Tenure Track (9 Month)","Number of Female Instructors Non-Tenure Track (9 Month)","Number of Female Instructors Non-Tenure Track (9 Month)",AY,0,ft_female_instructor_ntt_9_month,number,,,,,,1,1,,2016
"Form 2: Full-Time Faculty Salary","Number of Female Instructors Tenure Track (9 Month)","Number of Female Instructors Tenure Track (9 Month)","Number of Female Instructors Tenure Track (9 Month)","Number of Female Instructors Tenure Track (9 Month)",AY,0,ft_female_instructor_tt_9_month,number,,,,,,1,1,,2016
"Form 2: Full-Time Faculty Salary","Number of Female Instructors Tenured (9 Month)","Number of Female Instructors Tenured (9 Month)","Number of Female Instructors Tenured (9 Month)","Number of Female Instructors Tenured (9 Month)",AY,0,ft_female_instructor_t_9_month,number,,,,,,1,1,,2016
"Form 2: Full-Time Faculty Salary","Number of Male Lecturers (9 Month)","Number of Male Lecturers (9 Month)","Number of Male Lecturers (9 Month)","Number of Male Lecturers (9 Month)",AY,0,ft_male_lecturer_number_9_month,number,,,,,,1,1,,2016
"Form 2: Full-Time Faculty Salary","Total Contracted Salaries Male Lecturers (9 Month)","Total Contracted Salaries Male Lecturers (9 Month)","Total Contracted Salaries Male Lecturers (9 Month)","Total Contracted Salaries Male Lecturers (9 Month)",AY,0,ft_male_lecturer_salaries_9_month,dollars,,,,,,1,1,,2016
"Form 2: Full-Time Faculty Salary","Number of Male Lecturers Non-Tenure Track (9 Month)","Number of Male Lecturers Non-Tenure Track (9 Month)","Number of Male Lecturers Non-Tenure Track (9 Month)","Number of Male Lecturers Non-Tenure Track (9 Month)",AY,0,ft_male_lecturer_ntt_9_month,number,,,,,,1,1,,2016
"Form 2: Full-Time Faculty Salary","Number of Male Lecturers Tenure Track (9 Month)","Number of Male Lecturers Tenure Track (9 Month)","Number of Male Lecturers Tenure Track (9 Month)","Number of Male Lecturers Tenure Track (9 Month)",AY,0,ft_male_lecturer_tt_9_month,number,,,,,,1,1,,2016
"Form 2: Full-Time Faculty Salary","Number of Male Lecturers Tenured (9 Month)","Number of Male Lecturers Tenured (9 Month)","Number of Male Lecturers Tenured (9 Month)","Number of Male Lecturers Tenured (9 Month)",AY,0,ft_male_lecturer_t_9_month,number,,,,,,1,1,,2016
"Form 2: Full-Time Faculty Salary","Number of Female Lecturers (9 Month)","Number of Female Lecturers (9 Month)","Number of Female Lecturers (9 Month)","Number of Female Lecturers (9 Month)",AY,0,ft_female_lecturer_number_9_month,number,,,,,,1,1,,2016
"Form 2: Full-Time Faculty Salary","Total Contracted Salaries Female Lecturers (9 Month)","Total Contracted Salaries Female Lecturers (9 Month)","Total Contracted Salaries Female Lecturers (9 Month)","Total Contracted Salaries Female Lecturers (9 Month)",AY,0,ft_female_lecturer_salaries_9_month,dollars,,,,,,1,1,,2016
"Form 2: Full-Time Faculty Salary","Number of Female Lecturers Non-Tenure Track (9 Month)","Number of Female Lecturers Non-Tenure Track (9 Month)","Number of Female Lecturers Non-Tenure Track (9 Month)","Number of Female Lecturers Non-Tenure Track (9 Month)",AY,0,ft_female_lecturer_ntt_9_month,number,,,,,,1,1,,2016
"Form 2: Full-Time Faculty Salary","Number of Female Lecturers Tenure Track (9 Month)","Number of Female Lecturers Tenure Track (9 Month)","Number of Female Lecturers Tenure Track (9 Month)","Number of Female Lecturers Tenure Track (9 Month)",AY,0,ft_female_lecturer_tt_9_month,number,,,,,,1,1,,2016
"Form 2: Full-Time Faculty Salary","Number of Female Lecturers Tenured (9 Month)","Number of Female Lecturers Tenured (9 Month)","Number of Female Lecturers Tenured (9 Month)","Number of Female Lecturers Tenured (9 Month)",AY,0,ft_female_lecturer_t_9_month,number,,,,,,1,1,,2016
"Form 2: Full-Time Faculty Salary","Number of Male No Rank (9 Month)","Number of Male No Rank (9 Month)","Number of Male No Rank (9 Month)","Number of Male No Rank (9 Month)",AY,0,ft_male_no_rank_number_9_month,number,,,,,,1,1,,2016
"Form 2: Full-Time Faculty Salary","Total Contracted Salaries Male No Rank (9 Month)","Total Contracted Salaries Male No Rank (9 Month)","Total Contracted Salaries Male No Rank (9 Month)","Total Contracted Salaries Male No Rank (9 Month)",AY,0,ft_male_no_rank_salaries_9_month,dollars,,,,,,1,1,,2016
"Form 2: Full-Time Faculty Salary","Number of Male No Rank Non-Tenure Track (9 Month)","Number of Male No Rank Non-Tenure Track (9 Month)","Number of Male No Rank Non-Tenure Track (9 Month)","Number of Male No Rank Non-Tenure Track (9 Month)",AY,0,ft_male_no_rank_ntt_9_month,number,,,,,,1,1,,2016
"Form 2: Full-Time Faculty Salary","Number of Male No Rank Tenure Track (9 Month)","Number of Male No Rank Tenure Track (9 Month)","Number of Male No Rank Tenure Track (9 Month)","Number of Male No Rank Tenure Track (9 Month)",AY,0,ft_male_no_rank_tt_9_month,number,,,,,,1,1,,2016
"Form 2: Full-Time Faculty Salary","Number of Male No Rank Tenured (9 Month)","Number of Male No Rank Tenured (9 Month)","Number of Male No Rank Tenured (9 Month)","Number of Male No Rank Tenured (9 Month)",AY,0,ft_male_no_rank_t_9_month,number,,,,,,1,1,,2016
"Form 2: Full-Time Faculty Salary","Number of Female No Rank (9 Month)","Number of Female No Rank (9 Month)","Number of Female No Rank (9 Month)","Number of Female No Rank (9 Month)",AY,0,ft_female_no_rank_number_9_month,number,,,,,,1,1,,2016
"Form 2: Full-Time Faculty Salary","Total Contracted Salaries Female No Rank (9 Month)","Total Contracted Salaries Female No Rank (9 Month)","Total Contracted Salaries Female No Rank (9 Month)","Total Contracted Salaries Female No Rank (9 Month)",AY,0,ft_female_no_rank_salaries_9_month,dollars,,,,,,1,1,,2016
"Form 2: Full-Time Faculty Salary","Number of Female No Rank Non-Tenure Track (9 Month)","Number of Female No Rank Non-Tenure Track (9 Month)","Number of Female No Rank Non-Tenure Track (9 Month)","Number of Female No Rank Non-Tenure Track (9 Month)",AY,0,ft_female_no_rank_ntt_9_month,number,,,,,,1,1,,2016
"Form 2: Full-Time Faculty Salary","Number of Female No Rank Tenure Track (9 Month)","Number of Female No Rank Tenure Track (9 Month)","Number of Female No Rank Tenure Track (9 Month)","Number of Female No Rank Tenure Track (9 Month)",AY,0,ft_female_no_rank_tt_9_month,number,,,,,,1,1,,2016
"Form 2: Full-Time Faculty Salary","Number of Female No Rank Tenured (9 Month)","Number of Female No Rank Tenured (9 Month)","Number of Female No Rank Tenured (9 Month)","Number of Female No Rank Tenured (9 Month)",AY,0,ft_female_no_rank_t_9_month,number,,,,,,1,1,,2016
"Form 2: Full-Time Faculty Salary","Number of Male Faculty (9 Month)","Number of Male Faculty (9 Month)","Number of Male Faculty (9 Month)","Number of Male Faculty (9 Month)",AY,0,ft_male_faculty_number_9_month,number,,,,,1,1,,,2016
